{
  "schema_version": "1.0.0",
  "seq": 17,
  "entry_id": "0192a1b2-c3d4-7e5f-8a9b-0c1d2e3f4a80",
  "ts": "2026-08-24T11:00:00Z",
  "prev_hash": "0123456789abcdef0123456789abcdef0123456789abcdef0123456789abcdef",
  "entry_hash": "fedcba9876543210fedcba9876543210fedcba9876543210fedcba9876543210",
  "action": "forget.execute",
  "decision": "allowed",
  "reason_code": "USER_REQUESTED",
  "subject_refs": ["0192a1b2-c3d4-7e5f-8a9b-0c1d2e3f4a50"],
  "counts": { "items": 1 },
  "plan_hash": null,
  "capability_token_id": null,
  "egress_class": "none"
}
